<!DOCTYPE rbc2 SYSTEM "rbc2.dtd">
<!-- Created by Proximity -->

<rbc2>
  <estimator-class>kdl.prox.model2.rbc.estimators.MultinomialEstimator</estimator-class>
  <class-label>
    <source>
      <source-class>kdl.prox.model2.common.sources.AttributeSource</source-class>
      <data-type>str</data-type>
      <is-continuous>false</is-continuous>
      <is-single-value>true</is-single-value>
      <source-elements>
        <item-name>core</item-name>
        <attr-name>coreAttr1</attr-name>
      </source-elements>
    </source>
    <class-label-distr>
      <distr-class>kdl.prox.model2.common.probdistributions.DiscreteProbDistribution</distr-class>
      <class-label-info class="+" count="3.0" />
      <class-label-info class="-" count="3.0" />
    </class-label-distr>
  </class-label>
  <sources>
    <source-element>
      <source>
        <source-class>kdl.prox.model2.common.sources.AttributeSource</source-class>
        <data-type>str</data-type>
        <is-continuous>false</is-continuous>
        <is-single-value>false</is-single-value>
        <source-elements>
          <item-name>relation</item-name>
          <attr-name>relAttr1</attr-name>
        </source-elements>
      </source>
      <conditional-distr>
        <conditional-distr-info>
          <label>+</label>
          <class-label-distr>
            <distr-class>kdl.prox.model2.common.probdistributions.DiscreteProbDistribution</distr-class>
            <class-label-info class="N" count="3.0" />
          </class-label-distr>
        </conditional-distr-info>
        <conditional-distr-info>
          <label>-</label>
          <class-label-distr>
            <distr-class>kdl.prox.model2.common.probdistributions.DiscreteProbDistribution</distr-class>
            <class-label-info class="N" count="1.0" />
            <class-label-info class="Y" count="1.0" />
          </class-label-distr>
        </conditional-distr-info>
      </conditional-distr>
    </source-element>
    <source-element>
      <source>
        <source-class>kdl.prox.model2.common.sources.AttributeSource</source-class>
        <data-type>dbl</data-type>
        <is-continuous>true</is-continuous>
        <is-single-value>false</is-single-value>
        <source-elements>
          <item-name>peripheral</item-name>
          <attr-name>perAttr1</attr-name>
        </source-elements>
      </source>
      <conditional-distr>
        <conditional-distr-info>
          <label>+</label>
          <class-label-distr>
            <distr-class>kdl.prox.model2.common.probdistributions.ContinuousProbDistribution</distr-class>
            <class-label-info class="0.009999999776482582" count="1.0" />
            <class-label-info class="0.30000001192092896" count="1.0" />
            <class-label-info class="0.5" count="1.0" />
            <class-label-info class="0.6000000238418579" count="1.0" />
            <class-label-info class="0.699999988079071" count="1.0" />
          </class-label-distr>
        </conditional-distr-info>
      </conditional-distr>
    </source-element>
  </sources>
</rbc2>
